pmid,first_half,second_half_gold,word_count
33373354,"La válvula aórtica bicúspide es la cardiopatía congénita más frecuente en la población general. Lejos de ser solo una malformación valvular inocua, supone una enfermedad compleja y heterogénea. A menudo es identificada como un hallazgo incidental en personas sanas, cursando de manera asintomática. Sin embargo, en un alto porcentaje de pacientes conduce a lo largo de su vida a complicaciones valvulares (estenosis, insuficiencia, endocarditis) o aórticas (dilatación o disección). Con frecuencia estas manifestaciones suceden a una edad temprana y causan una elevada morbimortalidad. A pesar de que en los últimos años se ha producido una intensa investigación en este campo, la fisiopatogenia de la enfermedad no es del todo conocida y muchas preguntas siguen abiertas. En este artículo se revisan de forma actualizada los aspectos clínicos y fisiopatológicos más novedosos","y relevantes sobre esta cardiopatía congénita. The most common congenital heart disease in the general population is the bicuspid aortic valve. Far from being just a harmless valve malformation, it is a complex and heterogeneous disease. It is often identified as an incidental finding in healthy people. However, in a high percentage of patients it leads throughout their life towards valvular (stenosis, insufficiency, endocarditis) or aortic (dilatation or dissection) complications. Frequently, manifestations occur at an early age, being responsible for high morbidity and mortality. Even though in recent years intense research has been carried out in this field, the pathophysiogenesis of the disease is not fully known and many questions remain open. In this article, we review the most innovative and relevant clinical and pathophysiological aspects of this congenital heart disease.",261
33373349,"La insuficiencia valvular mitral provoca el vaciado simultáneo hacia la aorta y la aurícula izquierda durante la sístole ventricular, lo que produce una disminución del volumen hacia la circulación sistémica. En este estudio se busca obtener un dato preciso del porcentaje de volumen expulsado en sentido anterógrado en pacientes con insuficiencia mitral. Se aplica una fórmula ecocardiográfica de ""corrección"" de la fracción de expulsión del ventrículo izquierdo (FEVI) en 114 pacientes con insuficiencia mitral, con base en la medición de la fracción regurgitante. La corrección de la FEVI demostró que el 44.7% de los casos (n = 51) debe reclasificarse en cuanto a la calidad de su función sistólica ventricular izquierda. De 79 sujetos con FEVI normal (≥ 50%) sólo se mantuvieron 32 en la misma categoría; en el grupo con FEVI moderadamente reducida (intervalo intermedio, 40-49.9%) se pasó de 6 a 23 casos y, en aquéllos con FEVI reducida (< 40%), el grupo aumentó de 29 a 59; el subgrupo de pacientes con FEVI < 30% se incrementó de 21 a 41 sujetos. Puesto que en la mayoría de las guías de tratamiento la FEVI se usa para estratificar riesgos e indicaciones terapéuticas, los autores creen que la ponderación de la insuficiencia mitral puede incrementar la precisión del tratamiento y la posibilidad de incluir a pacientes que no están","considerados en esos tratamientos en el momento actual. Mitral valve regurgitation causes simultaneous emptying to the aorta and left atrium during ventricular systole, generating a decrease in volume supply to the systemic circulation. In this study we seek to obtain an accurate data on the percentage of volume expelled in the anterograde direction in patients with mitral regurgitation. An echocardiographic formula for “correction” of the left ventricular ejection fraction (LVEF) was applied in 114 patients with mitral regurgitation, based on the measurement of the regurgitant fraction. Correction of the LVEF showed that 44.7% of cases (n = 51) should be reclassified in terms of the quality of their left ventricular systolic function. Of 79 subjects with normal LVEF (≥ 50%) only 32 remained in the same category; in the group with moderately reduced LVEF (medium range, 40-49.9%) it went from 6 to 23 cases and, in those with reduced LVEF (< 40%), the group increased from 29 to 59; the subgroup of patients with LVEF < 30% increased from 21 to 41 subjects. Given that in most treatment guidelines LVEF is used to stratify risks and therapeutic indications, the authors believe that the weighting of mitral regurgitation can increase the accuracy of treatment, and the possibility of including patients who, at this current moment, are not considered for these therapies.",440
33373347,"Comparar las tasas de recurrencia de revascularización coronaria (cirugía o intervención coronaria percutánea), nuevo evento isquémico o muerte en pacientes con puentes secuenciales y con puentes simples. Cohortes ambispectivas de pacientes sometidos a cirugía de revascularización coronaria secuencial (n = 111) o simple (n = 145) entre el 1 de enero de 2013 y el 31 de diciembre de 2017. Pacientes mayores de 18 años en un primer procedimiento de revascularización, con circulación extracorpórea. Para el seguimiento se realizó revisión del expediente o comunicación telefónica hasta el 9 de febrero de 2019. Se investigaron los siguientes desenlaces: reintervención por isquemia coronaria, nuevo evento isquémico documentado o muerte atribuida a cardiopatía isquémica; también se obtuvieron curvas de sobrevida. La proporción de recurrencia según la técnica quirúrgica no fue estadísticamente diferente: secuencial 6.5% (intervalo de confianza del 95% [IC95%]: 2.6-12.6%) contra simple 4.8% (IC95%: 2-9.7%; p = 0.60; análisis bayesiano BF<sub>10</sub> = 0.37; evidencia moderada a no diferencia), todos por nuevo evento isquémico y un fallecimiento por grupo. No hubo diferencias en el tiempo de seguimiento: secuencial 59 meses (IC95%: 56-62) y simple 66 meses (IC95%: 64-68). No encontramos diferencia en las tasas de incidencia de recurrencia: secuencial 1.99 eventos/10<sup>3</sup> meses-paciente contra simple 1.47 (hazard ratio: 1.34; IC95%: 0.47-3.8; p = 0.58). El tiempo promedio de pinzamiento y de circulación extracorpórea por puente fue menor en el grupo de puentes combinados (41.44 minutos de circulación extracorpórea y 24.69 minutos de pinzamiento/puente) que en el de puentes simples (43 minutos en circulación extracorpórea y 26.4 minutos de pinzamiento/puente) cuando se ajusta al promedio de puentes colocados (simples 2.7 y secuencial 3.25; p < 0.001); sin embargo, no se encontró significancia estadística (p","= 0.7). Ambos procedimientos tuvieron una baja incidencia de recurrencia de eventos clínicos, sin diferencias entre las técnicas quirúrgicas. To compare the recurrence rates of revascularization (redo CABG or PCI), new ischemic event or death in patients with simple grafts and patients with sequential grafts. Study design is an ambispective cohort of patients that underwent CABG by sequential grafting (n = 111) or simple grafting (n = 145) between January 1<sup>st</sup>, 2013 and December 31<sup>st</sup>, 2017. Patients had to be 18 years old at the time of surgery, undergoing their first on-pump CABG. The clinical record of every patient was carefully reviewed and patients who had incomplete follow-up in external consultation were contacted by telephone in order to obtain data about ischemia related reintervention (CABG or PCI), new documented ischemic event or death caused by coronary artery disease, Kaplan-Meier estimators were calculated. The proportion of recurrence depending on technique was not statistically different: sequential (6.5% [CI95% 2.6-12.6%] versus simple 4.8% [CI95% 2-9.7%], p = 0.60, Bayesian analysis BF<sub>10</sub> = 0.37; moderate evidence to no difference), each one related to new ischemic event and one death per group. There were no differences in follow-up time (sequential 59m [CI95% 56-62] simple 66m [CI95% 64-68]). No difference was found regarding recurrence incidence rates; sequential 1.99 events x 10<sup>3</sup> months-patient, versus simple 1.47 (HR=1.34; CI95% 0.47-3.8, p = 0.58). Pump and cross-clamping times were lower for sequential technique (41.44 min; 24.69 min respectively) versus simple technique (43 min; 26.4 min respectively) with a p = 0.7 after adjusting to mean grafts per surgery (2.7 simple; 3.25 sequential, p < 0.001). Both techniques had a low incidence of clinical recurrence, without significant differences between procedures.",559
33373342,"La tormenta eléctrica (TE) se caracteriza por episodios repetidos de taquicardia ventricular o fibrilación ventricular relacionados con mal pronóstico a corto y largo plazos. El objetivo fue evaluar la prevalencia, resultados y supervivencia de los pacientes sometidos a tratamiento intervencionista por TE en un centro de referencia. Estudio unicéntrico, observacional y retrospectivo. Se revisaron los procedimientos de ablación por TE y se evaluaron las características basales de los pacientes, tipo de procedimiento, mortalidad total, recurrencia de arritmia, mortalidad cardiovascular y necesidad de trasplante. Desde enero de 2009 hasta diciembre de 2016 se realizaron 67 procedimientos (38% de complejos: 19% de ablación endoepicárdica, 7.5% de crioablación epicárdica quirúrgica, 3% de simpatectomía, 3% de inyección coronaria con alcohol; 6% de apoyo con oxigenación con membrana extracorpórea) en 41 pacientes (61% de causa isquémica) por TE. La mortalidad intraprocedimiento fue del 1.5%. La mediana de seguimiento fue de 23.5 meses (RIQ, 14.2-52.7). Tras el primer ingreso por TE (uno o varios procedimientos), la mortalidad a un año fue de 9.8%. La incidencia acumulada de trasplante cardiaco por TE fue de 2.4%. En el análisis multivariado, el riesgo de recurrencias arrítmicas o muerte por cualquier causa fue significativamente mayor en pacientes con arritmias clínicas inducibles (HR, 9.03; p = 0.017). El tratamiento de pacientes con TE, instituido en un centro de referencia y con experiencia, se relacionó con una tasa baja de recurrencia y supervivencia elevada, con una tasa de trasplante cardiaco","por TE muy baja. Ante una recurrencia temprana es recomendable practicar un nuevo procedimiento durante el ingreso. Electrical storm (ES) is characterized by repeated episodes of ventricular tachycardia or ventricular fibrillation, with poor short and long term prognosis. Our objective was to evaluate the prevalence, results of interventional treatment and survival of patients undergoing interventional treatment for ES in our center. Retrospective, unicentric and observational study. ES ablation procedures were revised and data regarding baseline characteristics of the patients, type of procedure, total mortality, recurrence of arrhythmia, cardiovascular mortality and the need for transplantation were evaluated. From January 2009 to December 2016, 67 procedures (38% complex procedures: 19% epicardial ablation, 7.5% surgical epicardial crioablation, 3% simpatectomy, 3% coronary alcohol injection, 6% extracorporeal membrane oxygenation support) were performed in 41 patients (61% Ischemic etiology) due to ES. Intraprocedural mortality was 1.5%. The median follow-up was 23.5 months (IQR [14.2-52.7]). After the first admission for ES (one or several procedures), 1-year mortality was 9.8%. The cumulative incidence of cardiac transplantation was 2.4%. The risk of arrhythmic recurrences or death was significantly higher in patients with inducible clinical arrhythmias after ablation (HR: 9.03, p = 0.017). The treatment of patients with ES, performed in a reference center, allows obtaining good rates of recurrence and survival, with very low rates of cardiac transplantation for ES. In the presence of an early recurrence, it is advisable to perform a new procedure during admission.",476
33373340,"La dispersión transmural de la repolarización ventricular (DTMRV) es un factor de riesgo para muerte en pacientes con síndrome isquémico coronario agudo (SICA). Con el objetivo de conocer el efecto de la realización de angioplastia sobre la DTMRV, se estudió la relación Tp-f/QTc en pacientes con SICA sometidos a angioplastia. Se diseñó un estudio observacional, retrospectivo y descriptivo. Se incluyeron 150 pacientes (N = 150) con diagnóstico de SICA. Se valoró la relación Tp-f/QTc inicial y se evaluó su acortamiento posangioplastia. Como objetivo secundario, se comparó la asociación de dichos cambios en la relación Tp-f/QTc con la mortalidad cardiovascular y los eventos adversos cardiovasculares. El promedio en la relación Tp-f/QTc inicial fue de 0.2529, mientras que posangioplastia fue de 0.2397. Por medio de prueba de rangos de Wilcoxon se evidenció un descenso significativo en la relación Tp-f/QTc posterior a la angioplastia, con un valor Z de -2.051 y una p < 0.04. En el análisis secundario se encontró que una Tp-f/QTc ≥ 0.29 posangioplastia es factor de riesgo para presentación de los siguientes eventos adversos: muerte intrahospitalaria (7.4 vs 0%; p < 0.003), nuevo SICA en seguimiento a 1 año (25.9 vs. 18.5%; p < 0.006) y reintervención en seguimiento a 1 año (29.6 vs. 15.0%; p < 0.002). Existe un acortamiento significativo en la relación Tp-f/QTc posangioplastia en pacientes con SICA. Esta medida de la DTMRV puede servir como un predictor de muerte intrahospitalaria, eventos","cardiovasculares y reintervención a 1 año en pacientes con SICA tratados con angioplastia. Transmural Dispersion of Repolarization (TDR) is a Risk factor for Death in patients with Acute Coronary ­Syndrome (ACS). In order to know the effect of angioplasty on TDR, the Tp-e/QTc ratio was studied in patients with ACS undergoing angioplasty. An observational, retrospective and descriptive study was designed. 150 patients (N = 150) with diagnosis of ACS were included. The initial Tp-e/QTc ratio was assessed and then its post-angioplasty shortening was evaluated. As a secondary objective, we compared the association of these Tp-e/QTc ratio changes with cardiovascular mortality and cardiovascular adverse events. The average in the initial Tp-e/QTc ratio was 0.2529, while post-angioplasty was 0.2397. Through a Wilcoxon rage test, a significant decrease in the Tp-e/QTc ratio after angioplasty was observed, with a Z value of −2.051 and p < 0.04. In the secondary analysis, it was found that a Tp-e/QTc ≥ 0.29 post-angioplasty is a risk factor for presenting the following adverse events: in-hospital death (7.4 vs. 0%; p < 0.003), new ACS in 1-year follow-up (25.9 vs. 18.5%; p < 0.006), and reintervention in 1-year follow up (29.6 vs. 15%; p < 0.002). There is a significant shortening in the Tp-e/QTc ratio post-angioplasty in patients with ACS. This measure of TDR can serve as a predictor of in-hospital death, cardiovascular events and 1-year reintervention in patients with ACS treated initially by angioplasty.",472
33373339,"Determinar las características radiográficas, electrocardiográficas, angiográficas y quirúrgicas de los pacientes operados con coartación aórtica en el Instituto Nacional de Cardiología Ignacio Chávez entre los años 2009 y 2018. Se recabaron del expediente electrónico las variables consideradas relevantes para el estudio y se registraron en la hoja de captura Excel previamente diseñada. Se analizaron diversas variables radiográficas, electrocardiográficas, angiográficas y quirúrgicas. Se valoró la evolución clínica posquirúrgica, complicaciones, requerimiento de procedimientos intervencionistas o quirúrgicos, y se valoró la respuesta a estos y también los diferentes desenlaces. Se reportan 187 cirugías de pacientes desde los 2 días de vida hasta los 12 años, en donde se mencionan las características radiológicas, electrocardiográficas y edad de presentación. El total de fallecimientos en los 9 años fue de 17 casos, los cuales en su gran mayoría (94%) fueron antes del primer año de vida. La técnica quirúrgica más utilizada (90%) fue la coartectomía extendida con anastomosis terminoterminal. Las complicaciones posquirúrgicas registradas fueron en orden descendente: insuficiencia ventricular izquierda, hipertensión arterial sistémica, insuficiencia renal que requirió diálisis peritoneal, etc. La población registrada que requirió una intervención quirúrgica en el Instituto Nacional de Cardiología fue en su mayoría «lactante menor», con una mediana de 3 meses de edad en el momento de la cirugía. Respecto a la técnica quirúrgica empleada, la que tuvo mejores resultados y que no demostró tener una asociación significativa con el número","de defunciones fue la coartectomía extendida con anastomosis terminoterminal. To determine the radiographic, electrocardiographic, angiographic and surgical characteristics of the patients operated with aortic coarctation at the Ignacio Chavez National Institute of Cardiology between 2009 and 2018. The variables considered relevant for the study were collected from the electronic file, recorded in the previously designed Excel capture sheet. Various radiographic, electrocardiographic, angiographic and surgical variables were analyzed. Post-surgical clinical evolution, complications, requirements for interventional or surgical procedures were assessed, and the response to these as well as the different outcomes was assessed. 187 patient surgeries are reported from 2 days of age to 12 years, where the radiological, electrocardiographic characteristics and presentation age are mentioned. The total number of deaths in the 9 years was 17 cases, which were mostly (94%) before the first year of life. The most commonly used surgical technique (90%) was extended coartectomy with term-terminal anastomosis. The recorded postoperative complications were in descending order: ventricular failure, systemic arterial hypertension, renal failure that required peritoneal dialysis, etc. The registered population that required surgical intervention at the National Institute of Cardiology was mostly a minor infant with a median of 3 months in their surgery age. In view of the surgical technique used, the one that had better results and that did not show a significant association with the number of deaths was the extended coartectomy with end-to-end anastomosis.",461
33373338,"El sistema de calificación APACHE II permite predecir la mortalidad intrahospitalaria en terapia intensiva. Sin embargo, no está validado para cirugía cardíaca, ya que no posee buena capacidad diferenciadora. El objetivo es determinar el valor pronóstico de APACHE II en el postoperatorio de procedimientos cardíacos. Se analizó en forma retrospectiva la base de cirugía cardíaca. Se incluyó a pacientes intervenidos entre 2017 y 2018, de los cuales se calculó la puntuación APACHE II. Se utilizó curva ROC para determinar el mejor valor de corte. El punto final primario fue mortalidad intrahospitalaria. Como puntos finales secundarios se evaluó la incidencia de bajo gasto cardíaco (BGC), accidente cerebrovascular (ACV), sangrado quirúrgico y necesidad de diálisis. Se realizó un modelo de regresión logístico multivariado para ajustar a las variables de interés. Se analizó a 559 pacientes. La media del sistema de calificación APACHE II fue de 9.9 (DE 4). La prevalencia de mortalidad intrahospitalaria global fue de 6.1%. El mejor valor de corte de la calificación para predecir mortalidad fue de 12, con un área bajo la curva ROC de 0.92. Los pacientes con APACHE II ≥ 12 tuvieron significativamente mayor mortalidad, incidencia de BGC, ACV, sangrado quirúrgico y necesidad de diálisis. En un modelo multivariado, el sistema APACHE II se relacionó de modo independiente con mayor tasa de mortalidad intrahospitalaria (OR, 1.14; IC95%, 1.08-1.21; p < 0.0001). El sistema de clasificación APACHE II demostró ser un predictor independiente de mortalidad intrahospitalaria en pacientes que cursan el postoperatorio","de cirugía cardíaca. The APACHE II score allows predicting in-hospital mortality in patients admitted to intensive care units. However, it is not validated for patients undergoing cardiac surgery, since it does not have a good discriminatory capacity in this clinical scenario. The aim of this study is to determine prognostic value of APACHE II score in postoperative of cardiac surgery. The study was performed using the cardiac surgery database. Patients undergoing surgery between 2017 and 2018, with APACHE II score calculated at the admission, were included. The ROC curve was used to determine a cut-off value The primary endpoint was in-hospital death. Secondary endpoints included low cardiac output (LCO), stroke, surgical bleeding, and dialysis requirement. A multivariable logistic regression model was developed to adjust to various variables of interest. The study evaluated 559 patients undergoing cardiac surgery. The mean of APACHE II Score was 9.9 (SD 4). The prevalence of in-hospital death was 6.1%. The best prognostic cut-off value for the primary endpoint was 12, with a ROC curve of 0.92. Patients with an APACHE II score greater than or equal to 12 had significantly higher mortality, higher incidence of LCO, stroke, surgical bleeding and dialysis requirement. In a multivariate logistic regression model, the APACHE II score was independently associated with higher in-hospital death (OR, 1.14; 95CI%, 1.08-1.21; p < 0.0001). The APACHE II Score proved to be an independent predictor of in-hospital death in patients undergoing postoperative cardiac surgery, with a high capacity for discrimination.",491
33373335,"El corazón pulmonar crónico (CPC) muestra un incremento en habitantes que viven en grandes altitudes. Investigar la frecuencia de arritmias cardíacas y factores de riesgo para su desarrollo. Estudio descriptivo y transversal; se revisó el registro de pacientes internados del Departamento de Cardiología del Instituto Nacional de Tórax, La Paz, Bolivia, entre enero de 2017 y junio de 2018; se incorporó a todos los individuos con diagnóstico de CPC, definido por criterios clínicos, electrocardiográficos y ecocardiográficos; se incluyó a 162 pacientes que cumplieron los criterios en el análisis; se utilizaron la t de Student y ANOVA. Arritmias: fibrilación auricular (FA), 125 (75%); aleteo auricular (AA), 17 (10.5%); taquicardia auricular (TA), 17 (10.5%); extrasístoles, 3 (1.9%). Según el análisis univariado, los factores relacionados con el desarrollo de arritmias fueron: eritrocitosis: FA, RR: 1.33, otras arritmias (RR: 1.67), p = 0.0001; hipertensión arterial pulmonar: FA, RR: 3.10, otras arritmias (RR: 3.21), p = 0.0001; dilatación de aurícula derecha (AD): FA, RR: 1.92, otras arritmias (RR: 2.13), p = 0.0001; obesidad: FA, RR: 3.47, p = 0.001, otras arritmias (RR: 3.70), p = 0.001; hipertensión arterial sistémica: FA, RR: 3.10, p = 0.001, otras arritmias (RR: 3.21), p = 0.001. Según el análisis multivariado: eritrocitosis (RR: 2.2), dilatación de AD (RR: 1.2), p = 0.0001. Se encontró FA con mayor frecuencia en los pacientes con CPC; los factores de riesgo con mayor","significancia estadística para su presentación fueron la eritrocitosis y la dilatación de la AD. Chronic cor pulmonale (CPC), with increased presentation in high-altitude inhabitants. Investigating the frequency of cardiac arrhythmias, and risk factors for its development. Descriptive, cross-sectional study, the inpatient registry of the Department of Cardiology of the National Institute of Torax, La Paz-Bolivia, from January 2017 to June 2018 was reviewed, all were incorporated with the diagnosis of CPC, defined by clinical criteria, electrocardiographic and echocardiographic, 162 patients who met the criteria were taken, the student’s t-test and ANOVA were used for the analysis. Arrhythmias: atrial fibrillation (AF) 125 (75%), atrial flutter (AA) 17 (10.5%), atrial tachycardia (AT) 17 (10.5%), extrasystoles 3 (1.9%). Univariate analysis of factors related to the development of arrhythmias: erythrocytosis: FA, RR: 1.33, other arrhythmias RR: 1.67, p = 0.0001, pulmonary arterial hypertension: FA, RR: 3.10, other arrhythmias RR: 3.21, p = 0.0001, right atrial dilation (AD): FA, RR: 1.92, other arrhythmias RR: 2.13, p = 0.0001, obesity: FA, RR: 3.47, p = 0.001, other arrhythmias RR: 3.70, p = 0.001, systemic arterial hypertension: FA: RR: 3.10, p = 0.001, other arrhythmias RR: 3.21, p = 0.001. Multivariate analysis: erythrocytosis (RR: 2.2), AD dilation (RR: 1.2), p = 0.0001. AF was found more frequently in patients with CPC, the risk factors with the greatest statistical significance for presentation were: erythrocytosis and AD dilation.",458
33351364,"En Berkeley Inglaterra en1749 nace Edward Jenner, el hombre que cambió la historia de la medicina. En 1796 ya siendo médico visitaba tambos y observaba con espíritu crítico, las pústulas de las ordeñadoras ocasionadas por la viruela vacuna. En esa época morían anualmente en el mundo 9 millones de personas. Jenner sabía por Lady Montagu (esposa del embajador ingles en Turquía) que allí inoculaban desde 1721 virus","de lesiones de viruela humana. Si bien algunos se inmunizaban, un gran número moría. En sus visitas a las ordeñadoras, una de ellas le dijo que no tenía miedo a la viruela porque estaba protegida por la contaminación vacuna. A ella le pidió que permitiera inocular con material de sus pústulas a su hijo de 8 años James Phipps, el niño tuvo fiebre leve que supero en días....",135
