pmid,first_half,second_half_gold,word_count
33784279,"Evaluar la reproducibilidad y la seguridad de un programa de cirugía colorrectal laparoscópica en dos centros de Sudamérica. Se realizó un estudio analítico-descriptivo. Se revisaron retrospectivamente los registros clínicos de pacientes sometidos a cirugía videolaparoscópica colorrectal desde el año 2012 hasta el año 2018, en dos centros académicos de tercer nivel argentinos. Se analizaron datos demográficos, indicaciones y tiempos quirúrgicos, tasa de conversión, evolución posoperatoria, morbimortalidad y resecabilidad oncológica, y se comparó con el abordaje convencional. Se realizaron 505 cirugías. La edad media de los pacientes fue de 63.4 años y el 50.9% eran hombres. El tiempo operatorio medio fue de 175 minutos. La principal indicación fue cáncer de colon. La incidencia de conversión fue del 9.5%. El promedio de ganglios por pieza quirúrgica en patología neoplásica fue de 15.9. La morbilidad fue del 35.4%, en su mayoría complicaciones menores. La tasa de fístulas fue del 11.7%. La mortalidad a 30 días fue del 2.5%. La cirugía colorrectal laparoscópica podría representar una","opción segura y reproducible en un centro de tercer nivel de un país en desarrollo. To evaluate the feasibility and safeness of a colorectal laparoscopic program in two centers form South America. We retrospectively review the records of patients who underwent laparoscopic colorectal surgery from 2012 to 2018 in two tertiary care academic centers. Surgical indication, operative time, conversion rate, lymph nodes harvested, surgical margins and complications were analyzed. This results were then compared to the open approach. We collected data from 505 patients, mean age 63.4, 50.9% male. The most frequent indication was colon cancer, mean operative time was 175 minutes. Conversion rate was 9.5%, mean nodes harvested was 15.9 with free resection margins in every case. Morbidity was 35.4% at 30 days, most of them were minor complications. The leak rate was 11.7 %. The 30-day mortality was 2.5%. The laparoscopic approach for colorectal surgery might represent a safe and feasible option in an tertiary care hospital from a developing country.",325
33784270,"Introducción: Streptococcus gallolyticus subsp. pasteurianus es un coco grampositivo, catalasa negativo, perteneciente al grupo D de Lancefield, que se encuentra relacionado con cuadros de sepsis neonatal, específicamente con meningitis. Caso clínico: Se reporta el caso de un paciente de 2 meses con un cuadro de meningitis por S. gallolyticus subsp. pasteurianus. Se describen la","sintomatología y el abordaje diagnóstico y terapéutico. Asimismo, se realiza una revisión de la literatura que evidencia el subdiagnóstico de este agente como causa de meningitis en pediatría. Conclusiones: Este caso representa el primer aislamiento de este agente en el Hospital Nacional de Niños de Costa Rica, de la Caja Costarricense de Seguro Social.",108
33783460,"Introducción: La perforación intestinal espontánea es una condición que afecta principalmente a neonatos pretérmino. Caso clínico: Se presenta el caso de un neonato pretérmino de 26 semanas de gestación con neumoperitoneo en las primeras 24 horas de vida. Por lo precoz del cuadro y los hallazgos radiológicos, la primera hipótesis diagnóstica fue una perforación gástrica. Sin embargo, en la laparotomía se encontró una perforación ileal única, sin hallazgos de enterocolitis. Conclusiones: La perforación intestinal espontánea","se ha asociado con intervenciones médicas, como el uso concomitante de esteroides e indometacina. Otras intervenciones, como el uso de magnesio prenatal y la colocación de surfactante pulmonar de forma mínimamente invasiva, se han propuesto como factores de riesgo para su desarrollo. En la actualidad, deben evaluarse la perforación intestinal espontánea y sus asociaciones. Las presentes y futuras investigaciones podrían contribuir a aclarar el papel de las intervenciones mencionadas en la revisión preliminar de la literatura.",151
33775419,"Este artículo ha sido retirado por indicación del Editor Jefe de la revista, después de constatar que parte de su contenido había sido plagiado, sin mencionar la fuente original: European Heart Journal (2014) 35, 2873 926.: https://academic.oup.com/eurheartj/article/35/41/2873/407693#89325738 El autor de",correspondencia ha sido informado de la decisión y está de acuerdo con la retirada del artículo. El Comité Editorial lamenta las molestias que esta decisión pueda ocasionar. Puede consultar la política de Elsevier sobre la retirada de artículos en https://www.elsevier.com/about/our-business/policies/article-withdrawal,80
33661880,"El conducto arterioso permeable (CAP) es un defecto cardiaco congénito y se considera un problema de salud pública. Se presenta en un alto porcentaje de recién nacidos y en algunos mayores de 1 mes. El cierre farmacológico es el tratamiento inicial preferido, ya que ha tenido excelentes resultados; sin embargo, en aquellos casos en los que no es posible, está indicado el cierre quirúrgico. Evaluar la eficacia y la seguridad del cierre quirúrgico del CAP por cirujanos pediatras sin especialidad en cirugía cardiovascular. Ensayo clínico realizado en pacientes del Hospital General de Occidente, centro hospitalario público de segundo nivel, con diagnóstico de CAP, que requirieron corrección quirúrgica. Se revisaron en forma retrospectiva los expedientes de enero de 2001 a diciembre de 2018. Se incluyeron 224 pacientes divididos en dos grupos: grupo I, con 184 (82%) recién nacidos, y grupo II, con 40 (18%) niños grandes de 2 meses a 8 años de edad. A todos se les realizó cierre quirúrgico: 3 por toracoscopía y 221 por toracotomía posterolateral izquierda. Presentaron complicaciones 36 pacientes, lo que representa el 16% del total; solo el 5.3% fueron complicaciones mayores. Fallecieron 24 pacientes en el posoperatorio, lo que representa una mortalidad del 10.7%; ninguno falleció por complicaciones transquirúrgicas. El CAP es un defecto cardíaco congénito que se presenta en alto porcentaje en pacientes prematuros. El cierre farmacológico es el principal tratamiento por tener excelentes resultados en recién nacidos; sin embargo, en aquellos casos en los que no sea posible está indicado el cierre quirúrgico. Todos los pacientes fueron operados por cirujanos pediatras generales, con una sobrevida global del 92%. En los hospitales donde no hay cirujano cardiovascular pediátrico ni cardiólogo intervencionista, la corrección quirúrgica del CAP puede ser llevada a cabo por un cirujano pediatra. La técnica es reproducible, fácil de realizar y con mínimas complicaciones.","The Patent Ductus Arteriosus (PDA) is congenital heart defect and is considered a public health problem. It occurs in a high percentage of newborns and in some older than 1 month. Pharmacological closure is the preferred initial treatment, as it has had excellent results; however, in those cases where it is not possible, surgical closure is indicated. The objective is to evaluate the efficacy and safety of the surgical closure of the patent PDA when it is carried out by pediatric surgeons without specialization in cardiovascular surgery. This study was conducted at the West General Hospital, a 2nd level public hospital, with the diagnosis of patent ductus arteriosus that required surgical correction. For the collection of the information, the files from January 2001 to December 2018 were retrospectively reviewed. 224 patients were included; divided into two groups: Group I: 184 (82%) “newborns” and Group II: 40 (18%) “big children” with ages from 2 months to 8 years. All had a surgical closure; 3 by thoracoscopy and 221 by left posterolateral thoracotomy. 36 patients presented complications representing 16% of the total of patients, only 5.3% were major complications. 24 patients died in the postoperative period, representing a mortality of 10.7%, none died due to trans-surgical complications. PDA is a congenital heart defect that occurs in a high percentage of premature patients. The pharmacological closure is the principal treatment because it has had excellent results in newborns; however, in those cases where it is not possible, surgical closure it´s indicated. All patients were operated by general pediatric surgeons, with a global survival of 92%. We conclude that in hospitals where there is no pediatric cardiovascular surgeon or interventional cardiologist, the surgical correction of the PDA can be carried out by a general pediatric surgeon. The technique is reproducible, easy to perform and with minimal complications.",605
33661876,"La terapia de resincronización cardiaca mediante estimulación hisiana ha demostrado ser efectiva en pacientes con bloqueo de rama izquierda del haz de His e insuficiencia cardiaca. Paciente masculino, con 47 años de edad, con insuficiencia cardiaca, fracción de expulsión del 17% y miocardio dilatada idiopática, electrocardiograma en ritmo sinusal, bloqueo auriculoventricular de 1.<sup>er</sup> grado, intervalo PR 400 ms, bloqueo completo de rama derecha del haz de His, bloqueo del fascículo anterior de la rama izquierda del haz de His, duración del QRS 200 ms. Se decidió realizar estimulación selectiva del haz de His. La resincronización cardiaca biventricular convencional en pacientes con presencia de bloqueo completo de la rama derecha del haz de His no está indicada debido a la pobre respuesta al tratamiento. La estimulación hisiana permite reclutar la rama bloqueada y reestablecer la conducción a través de ella, de tal forma que, en ausencia de necrosis, se logre sincronía biventricular. En el caso presentado el reclutamiento de la rama derecha mediante estimulación hisiana se reflejó en el restablecimiento de la sincronía biventricular, medida por rastreo de marcas (speckle tracking) e","incremento significativo de la fracción de expulsión del ventrículo izquierdo del 17 al 36.6%, con un incremento absoluto del 19.6%. Cardiac resynchronization therapy has proven to be an effective therapy in patients with left bundle branch block and heart failure. Male, 47 years old, heart failure with a left ventricle ejection fraction of 17%, idiopathic heart failure. ECG with sinus rhythm, 1<sup>st</sup> degree AV block, PR 400 ms, complete right bundle branch block, anterior hemi-fascicle of the left bundle of His, and QRS duration 200 ms. We decided to perform a selective His bundle pacing. In patients with right bundle branch block the biventricular cardiac resynchronization is not indicated due to low treatment response. His bundle pacing allows recruiting the blocked branch and restoring conduction throughout it, therefore, in the absence of necrosis the biventricular synchrony is achieved. We presented a case of His bundle pacing with recruitment of the right bundle branch, which reestablish biventricular synchrony measured by speckle tracking, and with a significant increase of the left ventricle ejection fraction from 17 to 36.6%, with an absolute increase of 19.6%.",363
33661872,"Los exosomas tienen un papel clave en la comunicación intercelular. Debido a sus múltiples interacciones, estas estructuras cumplen con el papel de «mensajeros» de forma dinámica, transportando su contenido a células blanco específicas y generando nuevas señales celulares. En este artículo se describen algunas de las proteínas, lípidos y ácidos nucleicos que son transportados por estas vesículas y que se han relacionado con cardioprotección, con la finalidad de proporcionar información y generar interés sobre la relevancia de los exosomas como posibles","blancos diagnósticos y terapéuticos. Exosomes have a key role in intercellular communication. Due to their multiple interactions, these structures fulfill the role of “messengers” in a dynamic way, transporting their content to target-specific cells and generating new cellular signals. This article describes some of the proteins, lipids and nucleic acids that are transported by these vesicles and that have been related to cardioprotection, in order to provide information and generate interest in the relevance of exosomes as possible diagnostic and therapeutic targets.",163
33661871,"Los defectos cardíacos congénitos constituyen el 30% de todas las anomalías congénitas. La prevalencia es de 8/1,000 recién nacidos vivos, sin predominio de género. Para una planificación quirúrgica óptima es esencial una evaluación precisa de la anatomía en los defectos cardíacos congénitos. Las modalidades de imagen como el ecocardiograma, la angiografía por cateterismo cardíaco, la tomografía computarizada (TC) o la resonancia magnética (RM) se utilizan de forma regular para el diagnóstico de las cardiopatías congénitas. Estos métodos pueden proporcionar reconstrucciones virtuales en reconstrucción volumétrica o 3D, pero no réplicas táctiles reales de la anatomía cardíaca. Realizar modelos de corazón impresos en 3D con la finalidad de proporcionar réplicas táctiles 3D reales de la anatomía cardíaca para visualizar de forma detallada todas las perspectivas posibles de las estructuras extracardíacas o intracardíacas. Los datos de la imagen se obtuvieron en formato DICOM, se editaron en el paquete de software ""3D slicer 4.3"" y se exportaron para la impresión en formato de archivo (.stl). Con la impresión 3D se puede evaluar de forma detallada la anatomía intracardíaca y extracardíaca con modelos cardíacos en tiempo real. Esta técnica es de gran utilidad, sobre todo en los","defectos cardíacos congénitos complejos, ya que permite hacer una planificación precisa del procedimiento quirúrgico. Congenital heart disease makes up for 30% of all congenital anomalies. The prevalence is 8/1,000 live newborns, without predominance of gender. Imaging methods such as echocardiography, angiography, computed tomography or magnetic resonance imaging must be routinely used in congenital heart disease. The mentioned methods can provide virtual reconstructions in volumetric reconstruction or in three dimensional (3D), but only 3D-printed heart models can provide real 3D tactile replicas of cardiac anatomy. To make 3D printed heart models in order to provide real 3D tactile replicas of the cardiac anatomy that allow a detailed visualization from all possible perspectives, either of extracardiac or intracardiac structures. This information is useful for surgical decision making, especially in patients with complex cardiac defects. DICOM, edited in a software package “3D slicer 4.3” and exported for printing in file format (.stl). With 3D printing, the intracardiac and extracardiac anatomy can be evaluated in detail with real-scale cardiac models of the patient, avoiding unexpected findings. This technique is very useful especially in complex congenital heart defects, since it allows precise planning of the surgical procedure.",384
33661870,"Las alteraciones del intercambio gaseoso se han reconocido en la obesidad mórbida; sin embargo, no se conoce su comportamiento conforme se incrementa el índice de masa corporal. Conocer el comportamiento del intercambio gaseoso a la altura de la Ciudad de México en el desarrollo de obesidad mórbida. Mediante un diseño transversal analítico se estudió a sujetos pareados por género y edad de cuatro grupos diferentes de índice de masa corporal (kg/m<sup>2</sup>): normal (18.5-24.9), sobrepeso (25-29.9), obesidad (30-39.9) y obesidad mórbida (≥ 40). Se obtuvieron sus antecedentes patológicos y demográficos, variables de gasometría arterial y espirometría simple. Las variables se determinaron de acuerdo con las características de la muestra; las diferencias entre grupos se realizaron mediante Anova de una vía con ajuste de Bonferroni, así como la correlación de Pearson para las variables relacionadas. Una p < 0.05 se consideró con significación estadística. Se estudió a 560 pacientes en cuatro grupos. La edad promedio fue de 49 ± 11 años. La mayor frecuencia de diabetes mellitus (34.29%), hipertensión arterial (50%) e hiperlipidemia (36.43%) se registró en el grupo de obesidad, y la de roncador (73.57%) en la obesidad mórbida. Se identificaron diferencias desde el grupo normal respecto de la obesidad mórbida: PaCO<sub>2</sub> 31.37 ± 2.08 vs. 38.14 ± 5.10 mmHg; PaO<sub>2</sub> 68.28 ± 6.06 vs. 59.86 ± 9.28 mmHg y SaO<sub>2</sub> 93.51 ± 1.93 vs. 89.71 ± 5.37%, todas con p = 0.0001. Correlación IMC-PaCO<sub>2</sub>: 0.497, e IMC-PaO<sub>2</sub>: -0.365, p = 0.0001, respectivamente. A la altitud de la Ciudad de México y con índice de masa corporal > 30 kg/m<sup>2</sup>, las variables relacionadas con el intercambio gaseoso","y espirometría simple comienzan a deteriorarse; son evidentes con IMC > 40 kg/m<sup>2</sup>. Alterations of gas exchange have been recognized in morbid obesity, however, it is not known how their behavior would be as the body mass index increases. To know the behavior of gas exchange at the level of Mexico City in the development of morbid obesity. Through analytical design, subjects matched by gender and age were studied from four different groups of body mass index (kg/m<sup>2</sup>), normal (18.5-24.9), overweight (25-29.9), obesity (30-39.9) and morbid obesity (≥ 40). Their pathological and demographic antecedents, arterial blood gas and simple spirometry variables were obtained. The variables were shown according to their sample characteristic. The differences between groups were made using one way Anova with Bonferroni adjustment, as well as Pearson’s correlation for the related variables. Statistical significance was considered with p < 0.05. 560 subjects were studied in 4 groups. The average age 49 ± 11 years old. The highest frequency of diabetes mellitus (34.29%), arterial hypertension (50%) and hiperlipidemia (36.43%) was in the obesity group, and being snoring (73.57%) in morbid obesity. There were differences from the normal group versus. morbid obesity: PaCO<sub>2</sub> 31.37 ± 2.08 versus. 38.14 ± 5.10 mmHg; PaO<sub>2</sub> 68.28 ± 6.06 versus. 59.86 ± 9.28 mmHg and SaO<sub>2</sub> 93.51 ± 1.93 versus. 89.71 ± 5.37%, all with p = 0.0001. The IMC-PaCO<sub>2</sub> correlation: 0.497, and IMC-PaO<sub>2</sub>: −0.365, p = 0.0001 respectively. At the altitude of Mexico City and body mass index > 30 kg/m<sup>2</sup> the variables related to gas exchange and simple spirometry begin to deteriorate; are evident with BMI > 40 kg/m<sup>2</sup>.",533
33650532,"OBJETIVOS 1. Saber que ha sido de los requerimientos judiciales por presunta mala praxis, en relación a casos de torsión testicular (TT). 2. Comentar lo ajustable a protocolo y guía clínica, en referencia a los ""escrotos agudos - EA"" y",en concreto a lo que refiere a las TT. 3. Buscar vías que eviten los procedimientos judiciales en los EA y en concreto en las TT. 4. Conocer las conductas de riesgo e implantar las ajustadas a la normo praxis asistencial.,81
33434914,La pancreatitis aguda es una enfermedad inflamatoria del páncreas. Se observa con mayor frecuencia en niños bajo tratamiento por alguna enfermedad hematooncológica y se asocia principalmente con la administración de L-asparaginasa. Identificar esta complicación de forma temprana y establecer un plan terapéutico adecuado,"puede mejorar el pronóstico y reducir el riesgo de otras complicaciones. En este trabajo se realizó una revisión crítica de la literatura actual, con especial énfasis en los aspectos clínicos, el diagnóstico y el tratamiento de la pancreatitis aguda en niños con cáncer.",86
38620899,"Presentar nuestra experiencia y analizar el pronóstico de pacientes COVID-19 con ictus isquémico agudo por oclusión de grandes vasos tratados con neurointervencionismo (NIV) en la unidad de ictus. Se incluyeron todos los pacientes consecutivos con ictus isquémico agudo debido a oclusión de grandes vasos tratados por NIV en nuestra institución entre marzo y abril de 2020, durante el brote de COVID-19. Se realizó una comparación entre pacientes con COVID-19 y pacientes sin infección por coronavirus. Se comunican los resultados clínicos iniciales y a corto plazo. Del 1 de marzo al 30 de abril se realizaron 25 procedimientos de NIV por ictus isquémico agudo en nuestra institución. Ocho pacientes eran COVID-19 y 17 eran pacientes no COVID-19. La edad media de los pacientes con COVID-19 fue de 70,1 ±","12,23 años, y 7 fueron hombres (87,5%, p = 0,006). Mientras que todos los pacientes sin COVID procedían de urgencias, solo 5 pacientes con COVID-19 (62,5%) fueron atendidos desde urgencias por ictus (p = 0,01). Tres pacientes procedían de hospitalización. La tasa de mortalidad en pacientes sin COVID-19 fue del 5,8%, pero en pacientes con COVID-19 fue considerablemente alta (50%). Ningún parámetro analítico difirió entre ambos grupos. No se registraron hemorragias en esta serie.En comparación con el mismo período del año pasado, se observó una disminución de la actividad neurointervencionista del 39%. La mejor terapia médica y de NIV desembocó en malos resultados y una mortalidad dramática. La pandemia de COVID-19 dificultó significativamente el funcionamiento normal de los servicios de urgencias y la atención de estos pacientes con ictus.",257
33373357,"El síndrome cardiorrenal (SCR) es un trastorno en el que intervienen el corazón y los riñones, interactuando y produciendo una disfunción entre ellos en forma aguda o crónica. Existen diferentes fenotipos clínicos bien identificados como «desórdenes del corazón y riñón en los que la disfunción aguda o crónica en un órgano induce la disfunción aguda o crónica del otro». La alta incidencia de morbimortalidad cardiovascular presente en los pacientes con enfermedad renal crónica terminal (ERCT), en especial la insuficiencia cardiaca (IC), origina inicialmente una lesión miocárdica que conlleva remodelamiento ventricular, lo cual induce a la activación de mecanismos compensadores, entre los cuales el riñón es pieza fundamental, ya que regula la homeostasis hidroelectrolítica y así el volumen circulante, siendo esto en la etapa dialítica más evidente. Los cambios funcionales y anatómicos cardiovasculares que se producen en estos pacientes son muy prevalentes e incluyen las interacciones hemodinámicas del corazón y los riñones en la insuficiencia cardiaca, y el impacto de la enfermedad aterosclerótica en ambos sistemas de órganos. También describimos estrategias diagnósticas y terapéuticas aplicables al síndrome cardiorrenal, que determinan la importancia de la ecocardiografía como modelo de diagnóstico útil. Finalmente, se analizan las posibilidades de tratamiento y la remisión de las alteraciones funcionales cardiacas con","el trasplante renal en los pacientes con ERCT. Cardiorenal syndrome (CRS) is a disorder in which the heart and kidneys are involved, interacting and producing a dysfunction between them in an acute or chronic way. There are different clinical phenotypes well identified as “heart and kidney disorders in which acute or chronic dysfunction in one organ induces acute or chronic dysfunction in the other”. The high incidence of cardiovascular morbimortality in patients with chronic terminal kidney disease (CKD), especially heart failure (HF), initially causes a myocardial lesion that leads to ventricular remodeling, which induces the activation of compensatory mechanisms, among which the kidney is a fundamental part since it regulates the hydroelectrolytic homeostasis and thus the circulating volume, being this in the dialytic stage more evident. The functional and anatomical changes at cardiovascular level that occur in these patients are very prevalent, and include hemodynamic interactions of the heart and kidneys in heart failure and the impact of atherosclerotic disease in both organ systems. We also describe diagnostic and therapeutic strategies applicable to cardiorenal syndrome, which determine the importance of echocardiography as a useful diagnostic model. Finally, we analyze the possibilities of treatment and remission of cardiac functional alterations with renal transplantation in patients with T-CKD.",411
